{
  "schema_version": "0.2.0",
  "deck_operator_api": "0.2.0",
  "deck_id": "org.latentdeck.deck.d2",
  "deck_version": "0.2.1",
  "operator_id": "org.latentdeck.builtin.ld_d2",
  "operator_version": "0.2.0",
  "entrypoint": "latentdeck_operator_d2.operator:process_sources_host",
  "source_count": 2,
  "role_ids": ["carrier", "donor"],
  "controls": [
    {
      "control_id": "algorithm",
      "value_type": "enum",
      "default": "linear",
      "options": ["linear", "xs1", "xs2", "xs3", "xs4", "xs5"]
    },
    {
      "control_id": "mix",
      "value_type": "number",
      "default": 0.5,
      "minimum": 0.0,
      "maximum": 1.0,
      "step": 0.01
    },
    {
      "control_id": "mode",
      "value_type": "enum",
      "default": "hybridize",
      "options": ["hybridize", "interact"]
    },
    {
      "control_id": "interaction",
      "value_type": "number",
      "default": 0.0,
      "minimum": 0.0,
      "maximum": 1.0,
      "step": 0.01
    },
    {
      "control_id": "preserve",
      "value_type": "number",
      "default": 0.55,
      "minimum": 0.0,
      "maximum": 1.0,
      "step": 0.01
    },
    {
      "control_id": "chaos",
      "value_type": "number",
      "default": 0.0,
      "minimum": 0.0,
      "maximum": 1.0,
      "step": 0.01
    },
    {
      "control_id": "xs1_channel_a",
      "value_type": "integer",
      "default": 0,
      "minimum": 0,
      "maximum": 23,
      "step": 1
    },
    {
      "control_id": "xs1_channel_b",
      "value_type": "integer",
      "default": 1,
      "minimum": 0,
      "maximum": 23,
      "step": 1
    },
    {
      "control_id": "xs1_angle_degrees",
      "value_type": "number",
      "default": 30.0,
      "minimum": -180.0,
      "maximum": 180.0,
      "step": 1.0
    },
    {
      "control_id": "xs2_radius",
      "value_type": "integer",
      "default": 1,
      "minimum": 1,
      "maximum": 8,
      "step": 1
    },
    {
      "control_id": "xs3_high_gain",
      "value_type": "number",
      "default": 0.5,
      "minimum": -2.0,
      "maximum": 2.0,
      "step": 0.05
    },
    {
      "control_id": "xs4_epsilon",
      "value_type": "number",
      "default": 0.000001,
      "minimum": 0.00000001,
      "maximum": 0.001,
      "step": 0.00000001
    },
    {
      "control_id": "xs5_routing",
      "value_type": "enum",
      "default": "topk",
      "options": ["topk", "sinkhorn"]
    },
    {
      "control_id": "temperature",
      "value_type": "number",
      "default": 0.12,
      "minimum": 0.02,
      "maximum": 1.0,
      "step": 0.01
    },
    {
      "control_id": "top_k",
      "value_type": "integer",
      "default": 8,
      "minimum": 1,
      "maximum": 64,
      "step": 1
    },
    {
      "control_id": "sinkhorn_iterations",
      "value_type": "integer",
      "default": 5,
      "minimum": 2,
      "maximum": 12,
      "step": 1
    }
  ]
}
